{
  "id": "gad-7",
  "name": "Anxiety",
  "instruction": "Over the last 2 weeks, how often have you been bothered by any of the following problems?",
  "questions": [
    {
      "question": "Feeling nervous, anxious, or on edge",
      "id": "Anxious"
    },
    {
      "question": "Not being able to stop or control worrying",
      "id": "Constant worrying"
    },
    {
      "question": "Worrying too much about different things",
      "id": "Worrying too much"
    },
    {
      "question": "Trouble relaxing",
      "id": "Trouble relaxing"
    },
    {
      "question": "Being so restless that it is hard to sit still",
      "id": "Restless"
    },
    {
      "question": "Becoming easily annoyed or irritated",
      "id": "Irritable"
    },
    {
      "question": "Feeling afraid as if something awful might happen",
      "id": "Afraid"
    }
  ],
  "options": [
    {
      "text": "Not at all",
      "value": 0
    },
    {
      "text": "Several days",
      "value": 1
    },
    {
      "text": "More than half the days",
      "value": 2
    },
    {
      "text": "Nearly every day",
      "value": 3
    }
  ],
  "interpretationName": "Anxiety severity",
  "interpretationTable": [
    {
      "score": "0-4",
      "max": 4,
      "interpretation": "You have minimal or no symptoms â€“ keep up the good work!"
    },
    {
      "score": "5-9",
      "max": 9,
      "interpretation": "Your symptoms are relatively mild. Keep up the good work as you and your clinical social worker collaborate to decrease them even more!"
    },
    {
      "score": "10-14",
      "max": 14,
      "interpretation": "Your symptoms are in the moderate severity range. Please keep working with your clinical social worker and the rest of your team to help you feel better."
    },
    {
      "score": "15+",
      "max": 27,
      "interpretation": "You still have significant symptoms that could benefit from more treatment. Please keep working with your clinical social worker and the rest of your team to help you feel better."
    }
  ]
}
