{
  "id": "phq-9",
  "name": "Depression",
  "instruction": "Over the last 2 weeks, how often have you been bothered by any of the following problems?",
  "questions": [
    {
      "question": "Little interest or pleasure in doing things",
      "id": "Interest"
    },
    {
      "question": "Feeling down, depressed, or hopeless",
      "id": "Mood"
    },
    {
      "question": "Trouble falling or staying asleep, or sleeping too much",
      "id": "Sleep"
    },
    {
      "question": "Feeling tired or having little energy",
      "id": "Energy"
    },
    {
      "question": "Poor appetite or overeating",
      "id": "Appetite"
    },
    {
      "question": "Feeling bad about yourself or that you are a failure or have let yourself or your family down",
      "id": "Guilt"
    },
    {
      "question": "Trouble concentrating on things, such as reading the newspaper or watching television",
      "id": "Concentrating"
    },
    {
      "question": "Moving or speaking so slowly that other people could have noticed. Or the opposite being so fidgety or restless that you have been moving around a lot more than usual",
      "id": "Motor"
    },
    {
      "question": "Thoughts that you would be better off dead, or of hurting yourself",
      "id": "Suicide"
    }
  ],
  "options": [
    {
      "text": "Not at all",
      "value": 0
    },
    {
      "text": "Several days",
      "value": 1
    },
    {
      "text": "More than half the days",
      "value": 2
    },
    {
      "text": "Nearly every day",
      "value": 3
    }
  ],
  "interpretationName": "Depression severity",
  "interpretationTable": [
    {
      "score": "0-4",
      "max": 4,
      "interpretation": "You have minimal or no symptoms â€“ keep up the good work!"
    },
    {
      "score": "5-9",
      "max": 9,
      "interpretation": "Your symptoms are relatively mild. Keep up the good work as you and your clinical social worker collaborate to decrease them even more!"
    },
    {
      "score": "10-14",
      "max": 14,
      "interpretation": "Your symptoms are in the moderate severity range. Please keep working with your clinical social worker and the rest of your team to help you feel better."
    },
    {
      "score": "15+",
      "max": 27,
      "interpretation": "You still have significant symptoms that could benefit from more treatment. Please keep working with your clinical social worker and the rest of your team to help you feel better."
    }
  ]
}
